{
  "id": "5e19bee0-3aea-4355-a9f0-c6df9989ee7d",
  "displayName": "I-405 Bridge Structure",
  "name": "I-405 Bridge Structure",
  "state": "initialized",
  "iTwinId": "8a3c8b16-c1b7-4f86-95f5-1a6a23c3a4c9",
  "dataCenterLocation": "East US",
  "createdDateTime": "2026-01-12T16:02:11Z",
  "creatorId": "42101fba-847a-4f4e-85a8-a4bed89065e4"
}